{
  "profile": "GOST_R_52290_2024",
  "title": "ГОСТ Р 52290-2024 — размеры знаков по типоразмерам (прил. Д)",
  "sizeClasses": ["I", "II", "III", "IV"],
  "sizeClassNames": { "I": "малый", "II": "нормальный", "III": "большой", "IV": "очень большой" },
  "normRef": { "doc": "ГОСТ Р 52290-2024", "clause": "п. 3.12, 3.13; прил. Д" },
  "verification": "CuratorExtracted",
  "clauseReferencedTables": ["Д.2", "Д.3", "Д.4", "Д.5", "Д.6", "Д.7", "Д.8"],
  "markers": ["GOST-003", "GOST-004", "GOST-005", "GOST-006", "GOST-014"],
  "tables": [
    {
      "id": "Д.2", "figure": "Д.1", "shapeHint": "Triangle", "dims": ["A", "r"],
      "rows": [
        { "signs": "1.1, 1.2, 1.5 - 1.7, 1.9 - 1.14, 1.16, 1.17, 1.22 - 1.24, 1.26 - 1.33, 1.35, 2.3.1 - 2.3.7, 2.4",
          "sizes": { "I": { "A": 700 }, "II": { "A": 900 }, "III": { "A": 1200 } }, "r": 45 },
        { "signs": "1.8, 1.15, 1.18 - 1.21, 1.25",
          "sizes": { "I": { "A": 700 }, "II": { "A": 900 }, "III": { "A": 1200 }, "IV": { "A": 1500 } }, "r": 45 }
      ],
      "notes": [
        "r дан в объединённой ячейке — проверить, что он общий для обеих строк",
        "Для знака 1.25 при краткосрочных ремонтных работах допускается A до 550 мм",
        "Знаки 1.3.1, 1.3.2 — размеры только на рисунке Д.2"
      ]
    },
    {
      "id": "Д.3", "figure": "Д.3", "shapeHint": "Octagon", "dims": ["B"],
      "rows": [
        { "signs": "2.5", "sizes": { "II": { "B": 700 }, "III": { "B": 900 }, "IV": { "B": 1200 } } }
      ],
      "notes": ["Типоразмера I у знака 2.5 нет"]
    },
    {
      "id": "Д.4", "figure": "Д.4", "shapeHint": "Circle", "dims": ["D"],
      "rows": [
        { "signs": "2.6, 3.1 - 3.9, 3.11 - 3.16, 3.18.1 - 3.19, 3.21 - 3.23, 3.25 - 3.35, 4.1.1 - 4.3",
          "sizes": { "I": { "D": 600 }, "II": { "D": 700 }, "III": { "D": 900 } } },
        { "signs": "3.10, 4.4.1 - 4.5.7", "sizes": { "II": { "D": 700 } } },
        { "signs": "3.17.1 - 3.17.3, 4.6, 4.7", "sizes": { "II": { "D": 700 }, "III": { "D": 900 } } },
        { "signs": "3.20, 3.24", "sizes": { "I": { "D": 600 }, "II": { "D": 700 }, "III": { "D": 900 }, "IV": { "D": 1200 } } }
      ],
      "notes": ["Для знаков 3.27 - 3.30, 3.35 допускается уменьшение D до 250 мм"]
    },
    {
      "id": "Д.5", "figure": "Д.5", "shapeHint": "Square", "dims": ["B", "r"],
      "rows": [
        { "signs": "2.1, 2.2, 2.7, 5.5, 5.6, 5.19.1, 5.19.2, 5.20, 6.2, 6.4, 6.8.1 - 6.8.3, 8.13",
          "sizes": { "I": { "B": 600 }, "II": { "B": 700 }, "III": { "B": 900 } }, "r": 45 },
        { "signs": "5.8 - 5.14.3, 5.15.2 - 5.15.6, 5.15.9, 6.3.1, 6.3.2, 8.1.2",
          "sizes": { "II": { "B": 700 }, "III": { "B": 900 } }, "r": 45 },
        { "signs": "6.5 - 6.7, 6.20.1, 6.20.2", "sizes": { "I": { "B": 600 }, "II": { "B": 700 } }, "r": 45 },
        { "signs": "6.9.3", "sizes": {}, "classless": { "B_min": 1200 }, "r": 45 },
        { "signs": "6.14.1", "sizes": {}, "classless": { "B": 350 }, "r": 45 }
      ],
      "notes": [
        "Для знаков 2.1, 5.20 и 6.4 допускается уменьшение B до 350 мм, r при этом 20 мм",
        "2.1 и 2.2 — квадрат, повёрнутый на 45°: форма задаётся в каталоге, а не здесь"
      ]
    },
    {
      "id": "Д.6", "figure": "Д.6", "shapeHint": "RectangleHorizontal", "dims": ["H", "B"],
      "rows": [
        { "signs": "1.34.1, 1.34.2",
          "sizes": { "II": { "H": 500, "B_options": [615, 1160, 2250] }, "III": { "H": 700, "B_options": [865, 1625, 3150] } } },
        { "signs": "1.34.3",
          "sizes": { "II": { "H": 500, "B_options": [1160, 2250] }, "III": { "H": 700, "B_options": [1625, 3150] } } }
      ],
      "notes": ["Для типоразмера II допускается уменьшение H до 460 мм"]
    },
    {
      "id": "Д.7", "figure": "Д.7", "shapeHint": "RectangleVertical", "dims": ["H", "B", "r"],
      "rows": [
        { "signs": "5.1 - 5.4", "sizes": { "III": { "H": 1350, "B": 900 } }, "r": 45 },
        { "signs": "4.8.1 - 4.8.3, 5.16 - 5.18, 5.21, 5.22, 6.2.1", "sizes": { "I": { "H": 900, "B": 600 } }, "r": 45 },
        { "signs": "5.27 - 5.42", "sizes": { "I": { "H": 900, "B": 600 } }, "r": 45 },
        { "signs": "7.1 - 7.21", "sizes": { "II": { "H": 1050, "B": 700 }, "III": { "H": 1350, "B": 900 } }, "r": 45 },
        { "signs": "6.1", "sizes": { "IV": { "H": 2250, "B": 1500 } }, "r": 45 },
        { "signs": "6.16.1", "sizes": { "I": { "H": 600, "B": 250 }, "II": { "H": 700, "B": 300 } }, "r": 45 },
        { "signs": "6.19.1, 6.19.2", "sizes": { "IV": { "H": 2000, "B": 1500 } }, "r": 45 }
      ],
      "notes": [
        "Для знаков 5.16 - 5.18, 5.21, 5.22, 6.2.1 допускается уменьшение H и B до 800 и 500 мм",
        "Для знаков с внутренним освещением r допускается увеличивать до 100 мм"
      ]
    },
    {
      "id": "Д.8", "figure": "Д.8", "shapeHint": "RectangleHorizontal", "dims": ["H", "B", "r"],
      "rows": [
        { "signs": "1.4.1 - 1.4.6, 6.22, 8.1.3, 8.1.4, 8.2.2 - 8.11, 8.14 - 8.21.3, 8.24 - 8.27",
          "sizes": { "I": { "H": 300, "B": 600 }, "II": { "H": 350, "B": 700 }, "III": { "H": 450, "B": 900 } }, "r": 45 },
        { "signs": "5.7.1, 5.7.2, 5.23.2, 5.24.2, 6.14.2 - 6.16, 6.18.1 - 6.18.3",
          "sizes": { "II": { "H": 350, "B": 1050 }, "III": { "H": 450, "B": 1350 } }, "r": 45 },
        { "signs": "5.15.1, 5.15.7 - 5.15.8",
          "sizes": { "II": { "H": 700, "B": 1400 }, "III": { "H": 900, "B": 1800 } }, "r": 45 },
        { "signs": "6.13", "sizes": { "II": { "H": 200, "B": 300 }, "III": { "H": 350, "B": 450 } }, "r": 45 },
        { "signs": "6.14.1", "sizes": { "II": { "H": 350, "B": 700 } }, "r": 45 },
        { "signs": "6.21.1, 6.21.2", "sizes": { "II": { "H": 350, "B": 1050 } }, "r": 45 },
        { "signs": "8.1.1, 8.2.1, 8.12",
          "sizes": { "I": { "H": 300, "B": 600 }, "II": { "H": 350, "B": 700 }, "III": { "H": 450, "B": 900 }, "IV": { "H": 600, "B": 1200 } }, "r": 45 }
      ],
      "notes": [
        "Строка 2 в PDF разорвана переносом страницы — проверить её состав",
        "5.15.1, 5.15.7, 5.15.8 для двух полос: B уменьшают до 930 (II) и 1200 (III)",
        "5.15.7 для четырёх полос, 5.15.1 и 5.15.8 для четырёх и более: B увеличивают на 465 (II) или 600 (III) на каждую полосу сверх трёх",
        "6.13: более двух цифр и/или аббревиатура владельца дороги — B +135 (II) или +180 (III); одна-две цифры с аббревиатурой — B как для трёх цифр",
        "8.4.9 - 8.4.16: H увеличивают на 1/3",
        "1.4.1 - 1.4.6 стоят в таблице горизонтального формата — проверить ориентацию по рисунку Д.8"
      ]
    },
    {
      "id": "Д.9", "figure": "Д.9", "shapeHint": "RectangleVertical", "dims": ["H", "B"],
      "rows": [
        { "signs": "8.22.1 - 8.22.3", "sizes": { "II": { "H": 1700, "B": 500 } } }
      ],
      "notes": ["Допускается уменьшение B до 460 мм"]
    }
  ]
}
