{
  "profile": "GOST_32945_2014",
  "title": "ГОСТ 32945-2014 — заготовка профиля типоразмеров (прил. А)",
  "sizeClasses": ["1", "2", "3", "4", "5"],
  "sizeClassNames": {},
  "normRef": { "doc": "ГОСТ 32945-2014", "clause": "п. 4.4.3; прил. А, табл. А.1–А.4" },
  "verification": "Unverified",
  "clauseReferencedTables": ["А.1", "А.2", "А.3", "А.4"],
  "markers": ["GOST-015"],
  "tables": [],
  "notes": [
    "Куратор значения не извлекал: таблицы намеренно пустые.",
    "Заполняет студент по первоисточнику; до этого генератор возвращает находку, а не геометрию."
  ]
}
